{
  "schema_version": "0.3.0",
  "scene_id": "S01",
  "assumptions": [
    "Medical-bay acoustics, practical noise, chamber isolation, and controllability require a location sound survey.",
    "Argo's on-set playback versus an off-camera cue voice is unconfirmed.",
    "Any performer-mounted capture, wardrobe treatment, cabling, or playback level remains subject to performer consent and qualified review.",
    "The reflection anomaly remains acoustically unresolved."
  ],
  "sound_philosophy": "Keep listening close to Ninel: the bay begins as an impersonal mechanism, her chosen breath creates the first human-scale sound, the reflection is defined by restraint rather than proof, and Argo's pause opens the acoustic world toward the ship and planet.",
  "cues": [
    {
      "cue_id": "S01-A01",
      "beat_ids": ["S01-B01"],
      "shot_ids": ["S01-SH001", "S01-SH002"],
      "category": "ambience",
      "source": "Sealed medical-bay air, low ship hum, chamber vibration, and emergency-light practical state",
      "perspective": "Restricted and close through chamber glass, widening modestly when the chamber opens",
      "timing": "Establish under the countdown and widen on the chamber release into the seated view",
      "requirement": "Capture matched sealed/open bay and practical states plus clean room tone; survey light, monitor, ventilation, and camera-support noise",
      "dramatic_purpose": "Make the room feel operational before Ninel feels alive, then let her first access to space register"
    },
    {
      "cue_id": "S01-A02",
      "beat_ids": ["S01-B01"],
      "shot_ids": ["S01-SH001"],
      "category": "dialogue",
      "source": "Diagnostic voice counting down from ten",
      "perspective": "An impersonal system voice heard by Ninel inside the sealed chamber",
      "timing": "The count reaches seven exactly as Ninel takes her voluntary inhale",
      "requirement": "Provide a consistent performance reference and protect a clean countdown without fixing unconfirmed playback equipment",
      "dramatic_purpose": "Set a mechanical rhythm against which deliberate breathing becomes independent choice"
    },
    {
      "cue_id": "S01-A03",
      "beat_ids": ["S01-B01"],
      "shot_ids": ["S01-SH001", "S01-SH002"],
      "category": "effects",
      "source": "Frost movement, Ninel's first inhale, chamber release, body rise, hand contact, and restrained costume movement",
      "perspective": "Intimately aligned with Ninel's body, then naturally placed in the bay as she sits",
      "timing": "Frost shifts before the inhale; inhale lands on seven; chamber releases before the rise",
      "requirement": "Protect the inhale and quiet performance from mechanism, wardrobe, and camera noise; capture isolated repeatable action elements",
      "dramatic_purpose": "Turn breathing from a fact into a chosen experiment and give her movement physical reality"
    },
    {
      "cue_id": "S01-A04",
      "beat_ids": ["S01-B02"],
      "shot_ids": ["S01-SH002", "S01-SH003"],
      "category": "silence",
      "source": "A restrained thinning of ship hum, leaving minute movement and residual room tone",
      "perspective": "Held with Ninel's attempt to verify the monitor, never shifting inside the reflection",
      "timing": "Begin as she turns away, hold through the insert, and release when the monitor clears",
      "requirement": "Capture matched room tone and quiet passes with no confirming sting or special voice treatment",
      "dramatic_purpose": "Focus attention through subtraction while keeping the anomaly unresolved"
    },
    {
      "cue_id": "S01-A05",
      "beat_ids": ["S01-B03"],
      "shot_ids": ["S01-SH004"],
      "category": "dialogue",
      "source": "Argo's welcome and delayed answer",
      "perspective": "The ship speaking within the bay from Ninel's position without a discrete visible source",
      "timing": "The answer is withheld through ship rotation and failure lands after the planet reaches its mark",
      "requirement": "Establish a consistent cue performance and prevent any reference playback from compromising Ninel's clean dialogue",
      "dramatic_purpose": "Make Argo present but unreadable and turn private doubt into distrust of the ship"
    },
    {
      "cue_id": "S01-A06",
      "beat_ids": ["S01-B03"],
      "shot_ids": ["S01-SH004"],
      "category": "dialogue",
      "source": "Ninel's question and the attentive breath and stillness around it",
      "perspective": "Close to Ninel within the moving medium-close single",
      "timing": "Asked after Argo's welcome; preserve the full listening pause before the answer",
      "requirement": "Protect restrained speech and breath throughout the body turn and camera arc; preserve clean versions of the line and pause",
      "dramatic_purpose": "Let Ninel press for a fact while the silence exposes what Argo withholds"
    },
    {
      "cue_id": "S01-A07",
      "beat_ids": ["S01-B03"],
      "shot_ids": ["S01-SH004"],
      "category": "transition",
      "source": "Subtle structural groan and changing bay resonance motivated by ship rotation",
      "perspective": "Begins around Ninel and opens toward the slit as she and the camera turn",
      "timing": "Enter during Argo's pause and settle before the final word",
      "requirement": "Confirm controllable practical sources and capture isolated movement states and repeatable timing without masking dialogue",
      "dramatic_purpose": "Carry the scene from enclosed uncertainty to the scale of the revealed world"
    },
    {
      "cue_id": "S01-A08",
      "beat_ids": ["S01-B01", "S01-B02", "S01-B03"],
      "shot_ids": ["S01-SH001", "S01-SH002", "S01-SH003", "S01-SH004"],
      "category": "music-intent",
      "source": "No music within the scene",
      "perspective": "The audience remains with Ninel's breath, ship systems, and acoustic withholding",
      "timing": "Withhold music from the first eye opening through Argo's final word",
      "requirement": "Protect dialogue, effects, practical states, room tone, and quiet transitions so tension does not depend on music",
      "dramatic_purpose": "Preserve restrained unease and prevent music from confirming the anomaly or dictating the reveal"
    }
  ]
}
