{
  "schema_version": "0.3.0",
  "scene_id": "NINEL-E01-SC001",
  "assumptions": [
    "Location acoustics require a survey."
  ],
  "sound_philosophy": "Let breath interrupt the machine-controlled room.",
  "cues": [
    {
      "cue_id": "NINEL-E01-SC001-A01",
      "beat_ids": [
        "NINEL-E01-SC001-B01"
      ],
      "shot_ids": [
        "NINEL-E01-SC001-SH001",
        "NINEL-E01-SC001-SH002"
      ],
      "category": "effects",
      "source": "Ninel's first voluntary inhale",
      "perspective": "Close and aligned with Ninel.",
      "timing": "The inhale interrupts the diagnostic rhythm.",
      "requirement": "Protect clean breath, chamber, and room states.",
      "dramatic_purpose": "Make breath the first sound that belongs to Ninel."
    }
  ]
}
